{
  "schema_version": 1,
  "agent_id": "custom-openai-compatible",
  "mode": "custom",
  "track": "custom",
  "run_slug": "custom-openai-compatible",
  "adapter": "command",
  "base_url": null,
  "base_url_env": "VERITY_BENCHMARK_AGENT_BASE_URL",
  "model": null,
  "model_env": "VERITY_BENCHMARK_AGENT_MODEL",
  "api_key": null,
  "api_key_env": "VERITY_BENCHMARK_AGENT_API_KEY",
  "chat_completions_path": "/chat/completions",
  "models_path": "/models",
  "system_prompt_files": [
    "harness/PROMPT.md",
    "harness/POLICY.md",
    "harness/TOOLS.md",
    "harness/PROOF_PATTERNS.md"
  ],
  "temperature": 0.0,
  "max_completion_tokens": 2000,
  "max_attempts": 1,
  "max_tool_calls": 24,
  "require_run_lean_check_before_finalize": false,
  "headers": {},
  "header_envs": {},
  "extra_body": {
    "thinking": {
      "type": "disabled"
    }
  },
  "command": [
    "python3",
    "harness/openai_compatible_adapter.py"
  ],
  "request_timeout_seconds": 120
}
