{
  "schema_version": 1,
  "agent_id": "leanstral-completion",
  "mode": "custom",
  "track": "custom",
  "run_slug": "leanstral",
  "adapter": "command",
  "base_url": "https://spark-de79.gazella-vector.ts.net",
  "base_url_env": null,
  "model": "mistralai_Leanstral-128x3.9B-2603-Q4_K_M.gguf",
  "model_env": null,
  "api_key": null,
  "api_key_env": null,
  "chat_completions_path": "/completion",
  "models_path": "/models",
  "system_prompt_files": [
    "harness/PROMPT.md",
    "harness/POLICY.md",
    "harness/TOOLS.md",
    "harness/PROOF_PATTERNS.md"
  ],
  "temperature": 0.0,
  "max_completion_tokens": 2000,
  "max_attempts": 8,
  "max_tool_calls": 24,
  "headers": {},
  "header_envs": {},
  "extra_body": {},
  "command": [
    "python3",
    "harness/leanstral_completion_adapter.py"
  ],
  "request_timeout_seconds": 120
}
