{
  "schema_version": 1,
  "agent_id": "openai-proxy-fast",
  "track": "custom",
  "run_slug": "openai-proxy-fast",
  "adapter": "openai_compatible",
  "base_url": "https://agent-backend.thomas.md/v1",
  "base_url_env": null,
  "model": "builtin/fast",
  "model_env": null,
  "api_key": null,
  "api_key_env": "VERITY_BENCHMARK_AGENT_API_KEY",
  "chat_completions_path": "/chat/completions",
  "models_path": "/models",
  "system_prompt_files": [
    "harness/PROMPT.md",
    "harness/POLICY.md",
    "harness/TOOLS.md",
    "harness/PROOF_PATTERNS.md"
  ],
  "mode": "strict",
  "temperature": 0.0,
  "max_completion_tokens": 2000,
  "max_attempts": 8,
  "max_tool_calls": 24,
  "headers": {},
  "header_envs": {},
  "extra_body": {
    "thinking": {
      "type": "disabled"
    }
  },
  "request_timeout_seconds": 120
}
